{
  "$schema": "https://json-schema.org/draft/2020-12/schema",
  "$id": "https://locksmith/spec/micro-app-template/0.1",
  "title": "Micro-App Template",
  "description": "Canonical artifact describing one role's slice of operational behavior in a KERI-native ecosystem application.",
  "type": "object",
  "required": ["d", "spec_version", "header", "role", "credentials", "commands", "aggregates", "reactions", "workflows", "projections", "rules"],
  "additionalProperties": false,
  "properties": {
    "d": {
      "type": "string",
      "minLength": 44,
      "maxLength": 44,
      "description": "Self-SAID of this document. 44-character CESR-encoded Blake3-256 digest of the canonical form with d field placeholdered."
    },
    "spec_version": {
      "type": "string",
      "pattern": "^micro-app-template/[0-9]+\\.[0-9]+$",
      "description": "Version of the ecosystem-template meta-schema this document conforms to."
    },
    "header": { "$ref": "#/$defs/header" },
    "role": { "$ref": "#/$defs/role" },
    "credentials": {
      "type": "object",
      "required": ["held", "issued"],
      "additionalProperties": false,
      "properties": {
        "held": {
          "type": "array",
          "items": { "$ref": "#/$defs/held_credential" }
        },
        "issued": {
          "type": "array",
          "items": { "$ref": "#/$defs/issued_credential" }
        }
      }
    },
    "commands": {
      "type": "array",
      "items": { "$ref": "#/$defs/command" }
    },
    "aggregates": {
      "type": "array",
      "items": { "$ref": "#/$defs/aggregate" }
    },
    "reactions": { "type": "array", "items": { "type": "object" } },
    "workflows": { "type": "array", "items": { "type": "object" } },
    "projections": { "type": "array", "items": { "type": "object" } },
    "rules": { "type": "array", "items": { "type": "object" } }
  },
  "$defs": {
    "header": {
      "type": "object",
      "required": ["id", "display_name", "description", "version", "expression_language"],
      "additionalProperties": false,
      "properties": {
        "id": { "type": "string", "pattern": "^[a-z][a-z0-9-]*$" },
        "display_name": { "type": "string", "minLength": 1 },
        "description": { "type": "string", "minLength": 1 },
        "version": { "type": "string", "pattern": "^[0-9]+\\.[0-9]+(\\.[0-9]+)?$" },
        "expression_language": { "type": "string", "pattern": "^[A-Z][A-Za-z]*/[0-9]+\\.[0-9]+$" },
        "forked_from": {
          "type": "object",
          "required": ["template_said", "template_version", "forked_at"],
          "additionalProperties": false,
          "properties": {
            "template_said": { "type": "string", "minLength": 44, "maxLength": 44 },
            "template_version": { "type": "string" },
            "forked_at": { "type": "string", "format": "date" },
            "fork_intent": { "type": "string" }
          }
        }
      }
    },
    "role": {
      "type": "object",
      "required": ["id", "display_name", "description", "kind", "keri_infrastructure"],
      "additionalProperties": false,
      "properties": {
        "id": { "type": "string", "pattern": "^[a-z][a-z0-9_-]*$" },
        "display_name": { "type": "string", "minLength": 1 },
        "description": { "type": "string", "minLength": 1 },
        "kind": {
          "type": "string",
          "enum": ["individual", "organization", "system", "device", "agent", "government"]
        },
        "keri_infrastructure": {
          "type": "object",
          "required": ["witness_pool", "watcher_network", "mailbox", "acdc_registry"],
          "additionalProperties": false,
          "properties": {
            "witness_pool": { "type": "boolean" },
            "watcher_network": { "type": "boolean" },
            "mailbox": { "type": "boolean" },
            "acdc_registry": { "type": "boolean" }
          }
        }
      }
    },
    "held_credential": {
      "type": "object",
      "required": ["id", "expected_schema_said"],
      "additionalProperties": false,
      "properties": {
        "id": { "type": "string", "pattern": "^[a-z][a-z0-9_-]*$" },
        "expected_schema_said": { "type": "string", "minLength": 44, "maxLength": 44 },
        "expected_issuer_role": { "type": "string" },
        "expected_attribute_constraints": { "type": "object" },
        "lifecycle_acceptance": {
          "type": "array",
          "items": { "type": "string" },
          "default": ["active"]
        },
        "narrative": { "type": "string" }
      }
    },
    "edge_operator": {
      "type": "string",
      "enum": ["authorizes", "references", "authorizes-via-delegate"]
    },
    "disclosure_mode": {
      "type": "string",
      "enum": ["full", "selective", "aggregate"]
    },
    "tel_primitive": {
      "type": "string",
      "enum": ["issue", "update", "revoke"]
    },
    "issued_credential": {
      "type": "object",
      "required": ["id", "name", "description", "envelope", "schema", "lifecycle"],
      "additionalProperties": false,
      "properties": {
        "id": { "type": "string", "pattern": "^[a-z][a-z0-9_-]*$" },
        "name": { "type": "string", "minLength": 1 },
        "description": { "type": "string", "minLength": 1 },
        "envelope": {
          "type": "object",
          "required": ["holder_role", "verifier_roles", "edges", "disclosure_mode"],
          "additionalProperties": false,
          "properties": {
            "holder_role": { "type": "string" },
            "verifier_roles": { "type": "array", "items": { "type": "string" } },
            "edges": {
              "type": "array",
              "items": {
                "type": "object",
                "required": ["edge_name", "credential_id", "cardinality", "operator"],
                "additionalProperties": false,
                "properties": {
                  "edge_name": { "type": "string" },
                  "credential_id": { "type": "string" },
                  "cardinality": { "type": "string", "enum": ["one", "one_or_more"] },
                  "operator": { "$ref": "#/$defs/edge_operator" }
                }
              }
            },
            "disclosure_mode": { "$ref": "#/$defs/disclosure_mode" }
          }
        },
        "schema": {
          "type": "object",
          "required": ["schema_said", "schema_path"],
          "additionalProperties": false,
          "properties": {
            "schema_said": { "type": "string", "minLength": 44, "maxLength": 44 },
            "schema_path": { "type": "string", "pattern": "^schemas/[a-z][a-z0-9_-]*\\.json$" }
          }
        },
        "lifecycle": {
          "type": "object",
          "required": ["states", "initial", "transitions"],
          "additionalProperties": false,
          "properties": {
            "states": {
              "type": "array",
              "items": { "type": "string" },
              "minItems": 1,
              "uniqueItems": true
            },
            "initial": { "type": "string" },
            "transitions": {
              "type": "array",
              "items": {
                "type": "object",
                "required": ["id", "from", "to", "tel_primitive"],
                "additionalProperties": false,
                "properties": {
                  "id": { "type": "string" },
                  "from": {
                    "oneOf": [
                      { "type": "string" },
                      { "type": "array", "items": { "type": "string" } }
                    ]
                  },
                  "to": { "type": "string" },
                  "via_workflow": { "type": ["string", "null"] },
                  "tel_primitive": { "$ref": "#/$defs/tel_primitive" },
                  "trigger": { "type": "string", "enum": ["manual", "automatic"] },
                  "condition_rule_ref": { "type": "string" },
                  "requires": {
                    "type": "array",
                    "items": {
                      "type": "object",
                      "required": ["rule_ref"],
                      "additionalProperties": false,
                      "properties": { "rule_ref": { "type": "string" } }
                    }
                  }
                }
              }
            }
          }
        },
        "rule_refs": { "type": "array", "items": { "type": "string" }, "default": [] },
        "value_flow": {
          "type": "object",
          "required": ["implied_credentials"],
          "additionalProperties": false,
          "properties": {
            "implied_credentials": {
              "type": "array",
              "items": {
                "type": "object",
                "required": ["credential_id", "relationship"],
                "additionalProperties": false,
                "properties": {
                  "credential_id": { "type": "string" },
                  "relationship": {
                    "type": "string",
                    "enum": ["issuer_grants", "per_emission", "per_holder_emission", "implies_obligation"]
                  },
                  "description": { "type": "string" }
                }
              }
            }
          }
        }
      }
    },
    "rule_ref_obj": {
      "type": "object",
      "required": ["rule_ref"],
      "additionalProperties": false,
      "properties": { "rule_ref": { "type": "string" } }
    },
    "exchange": {
      "type": "object",
      "required": ["kind"],
      "oneOf": [
        {
          "required": ["kind", "verb"],
          "properties": {
            "kind": { "const": "credential" },
            "verb": { "type": "string", "enum": ["apply", "offer", "agree", "grant", "admit", "spurn"] },
            "credential_held_id": { "type": ["string", "null"] },
            "credential_issued_id": { "type": ["string", "null"] },
            "schema_said_referenced": { "type": ["string", "null"] }
          }
        },
        {
          "required": ["kind", "pattern", "route"],
          "properties": {
            "kind": { "const": "message" },
            "pattern": { "type": "string", "enum": ["command", "query", "notification"] },
            "route": { "type": "string", "pattern": "^/[a-z][a-z0-9_/-]*$" },
            "schema_id": { "type": "string" }
          }
        }
      ]
    },
    "emission": {
      "type": "object",
      "required": ["kind"],
      "oneOf": [
        {
          "required": ["kind", "exchange"],
          "properties": {
            "kind": { "const": "exchange" },
            "exchange": { "$ref": "#/$defs/exchange" }
          }
        },
        {
          "required": ["kind", "credential_issued_id", "to_state"],
          "properties": {
            "kind": { "const": "lifecycle_advance" },
            "credential_issued_id": { "type": "string" },
            "to_state": { "type": "string" }
          }
        },
        {
          "required": ["kind", "aggregate_id", "event_type", "payload_mapping"],
          "properties": {
            "kind": { "const": "aggregate_event" },
            "aggregate_id": { "type": "string" },
            "event_type": { "type": "string" },
            "payload_mapping": { "type": "string" }
          }
        }
      ]
    },
    "command": {
      "type": "object",
      "required": ["id", "name", "description", "route", "payload_schema", "idempotency_key_expression", "emissions"],
      "additionalProperties": false,
      "properties": {
        "id": { "type": "string", "pattern": "^[a-z][a-z0-9_-]*$" },
        "name": { "type": "string" },
        "description": { "type": "string" },
        "route": {
          "type": "string",
          "pattern": "^/[a-z][a-z0-9_/-]*$",
          "not": { "pattern": "^/ipex/" }
        },
        "counterparty_role": { "type": ["string", "null"] },
        "payload_schema": { "type": "object" },
        "auth_preconditions": { "type": "array", "items": { "$ref": "#/$defs/rule_ref_obj" } },
        "state_preconditions": { "type": "array", "items": { "$ref": "#/$defs/rule_ref_obj" } },
        "temporal_preconditions": { "type": "array", "items": { "$ref": "#/$defs/rule_ref_obj" } },
        "idempotency_key_expression": { "type": "string" },
        "emissions": { "type": "array", "items": { "$ref": "#/$defs/emission" } }
      }
    },
    "log_scope": { "type": "string", "enum": ["private", "witnessed", "shared"] },
    "aggregate": {
      "type": "object",
      "required": ["id", "description", "inception_event_type", "state_schema", "initial_state", "log_scope"],
      "additionalProperties": false,
      "properties": {
        "id": { "type": "string", "pattern": "^[a-z][a-z0-9_-]*$" },
        "description": { "type": "string" },
        "inception_event_type": { "type": "string" },
        "state_schema": { "type": "object" },
        "initial_state": {},
        "invariants": { "type": "array", "items": { "$ref": "#/$defs/rule_ref_obj" } },
        "log_scope": { "$ref": "#/$defs/log_scope" }
      }
    }
  }
}
