{
  "d": "############################################",
  "spec_version": "micro-app-template/0.1",
  "header": {
    "id": "REPLACE-ME",
    "display_name": "REPLACE ME",
    "description": "REPLACE ME — one paragraph describing the use case from this role's perspective.",
    "version": "0.1",
    "expression_language": "UEL/1.0"
  },
  "role": {
    "id": "REPLACE-ME",
    "display_name": "REPLACE ME",
    "description": "REPLACE ME — one paragraph describing this role's purpose in the ecosystem.",
    "kind": "individual",
    "keri_infrastructure": {
      "witness_pool": false,
      "watcher_network": false,
      "mailbox": true,
      "acdc_registry": false
    }
  },
  "credentials": {
    "held": [],
    "issued": []
  },
  "commands": [],
  "aggregates": [],
  "reactions": [],
  "workflows": [],
  "projections": [],
  "rules": []
}
