{
  "d": "############################################",
  "spec_version": "micro-app-template/0.1",
  "header": {
    "id": "credentials-test",
    "display_name": "Credentials Test Template",
    "description": "Exercises the credentials primitive.",
    "version": "0.1",
    "expression_language": "UEL/1.0"
  },
  "role": {
    "id": "carrier",
    "display_name": "Test Carrier",
    "description": "A carrier role for credential testing.",
    "kind": "organization",
    "keri_infrastructure": {
      "witness_pool": true,
      "watcher_network": true,
      "mailbox": true,
      "acdc_registry": true
    }
  },
  "credentials": {
    "held": [
      {
        "id": "carrier_license",
        "expected_schema_said": "EAuthorityIssuedSchemaSAID0000000000000xxxxx",
        "expected_issuer_role": "regulator",
        "lifecycle_acceptance": ["active"],
        "narrative": "License from a state regulator authorizes binding policies."
      }
    ],
    "issued": [
      {
        "id": "policy",
        "name": "Policy Credential",
        "description": "Insurance policy binding terms.",
        "envelope": {
          "holder_role": "policyholder_individual",
          "verifier_roles": ["broker"],
          "edges": [
            {
              "edge_name": "authority",
              "credential_id": "carrier_license",
              "cardinality": "one",
              "operator": "authorizes"
            }
          ],
          "disclosure_mode": "selective"
        },
        "schema": {
          "schema_said": "EPolicySchemaSAID000000000000000000000000000",
          "schema_path": "schemas/policy.json"
        },
        "lifecycle": {
          "states": ["pending", "active", "expired", "revoked"],
          "initial": "pending",
          "transitions": [
            {
              "id": "activate",
              "from": "pending",
              "to": "active",
              "tel_primitive": "issue"
            },
            {
              "id": "revoke",
              "from": ["active"],
              "to": "revoked",
              "tel_primitive": "revoke"
            }
          ]
        },
        "rule_refs": [],
        "value_flow": {
          "implied_credentials": []
        }
      }
    ]
  },
  "commands": [],
  "aggregates": [],
  "reactions": [],
  "workflows": [],
  "projections": [],
  "rules": []
}
